Problem Number,Problem Name,Language,Topic,Difficulty,Link,Needs Review,Date Completed,Reflection
0217,"contains-duplicate",python,hash,easy,https://leetcode.com/problems/contains-duplicate/,no,2025-03-07,"I made a hashset and iterated over the array and checked if any element appeared in that hashset again"
0344,"reverse-string",python,two-pointers,easy,https://leetcode.com/problems/reverse-string/,no,2025-03-07,"Use two pointers, a left pointer pointing at index and a right pointer point at the last index then swamped the two each time and then incremented the left pointer then decremented the right one until they reached an equal point"
0771,"jewels-and-stones",python,hash,easy,https://leetcode.com/problems/jewels-and-stones/,yes,2025-03-07,"I made a hashset then iterated over the string stones then checked if stones was in that hashset and then if it was I incremented the counter by 1"
0226,"invert-binary-tree",python,binary-tree,easy,https://leetcode.com/problems/invert-binary-tree/,no,2025-03-07,"I traveresed through the left subtree, then the right subtree and then swapped each node"
0704,"binary-search",python,binary-search,easy,https://leetcode.com/problems/binary-search/,no,2025-03-07,"Binary search algorithm..."
0242,"valid-anagram",python,hash,easy,https://leetcode.com/problems/valid-anagram/,yes,2025-03-07,"I used a counter from collections to intialize the dictionary and count the frequencies of each string, then after that i checked if dictionaries are equal to each other by iterating through the first dictionary then checking if the key in the first dictionary is not in the dictioanry 2 or if the values are not equal that would let us know if any of the values or keys dont match and they dont then we know its false"
